| Word | Explanation | Example | Image |
|:---|:---|:---|:---|
| Costume | A special set of clothes worn for a costume party, to represent a character, or for a performance. | Dracula costume | ![Dracula costume](https://images.pexels.com/photos/2586671/pexels-photo-2586671.jpeg?auto=compress&cs=tinysrgb&dpr=2&h=750&w=1260) |
| Gown | A formal dress, usually long and full-length, which is worn for a special occasion. | Wedding gown | ![Wedding gown](https://images.pexels.com/photos/3151750/pexels-photo-3151750.jpeg?auto=compress&cs=tinysrgb&dpr=2&h=750&w=1260) |
| Skirt | A garment which covers the lower half of the body, typically with material that hangs down. | Long skirt | ![Long skirt](https://images.pexels.com/photos/3931949/pexels-photo-3931949.jpeg?auto=compress&cs=tinysrgb&dpr=2&h=750&w=1260) |
| Shorts | A casual garment which covers the lower half of the body, typically with short material. | Bermuda shorts | ![Bermuda shorts](https://images.pexels.com/photos/1065719/pexels-photo-1065719.jpeg?auto=compress&cs=tinysrgb&dpr=2&h=750&w=1260) |
| Leggings | A type of pants which are form-fitting, typically made of a stretchable material. | Yoga leggings | ![Yoga leggings](https://images.pexels.com/photos/1932010/pexels-photo-1932010.jpeg?auto=compress&cs=tinysrgb&dpr=2&h=750&w=1260) |
