;"""New Gene Names"; Chromosome; Start Position; End Position; Strand; Gene Type; Sequence; Expression Level; Mutation Frequency; Protein Interactions;" Additional Features"""
0;" ""ATP-binding cassette transporter A1"; 17; 41535205; 41546929; +; Protein-coding; ATCACGATG... (nucleotide sequence shortened); Medium; 0.0056; Various intracellular interactions;" Presence in multiple cell types"""
1;"""BCL2-associated X, apoptosis regulator"; 19; 41745210; 41753027; -; Protein-coding; GGCCCTGTG... (nucleotide sequence shortened); High; 0.012; Interacts with BCL2 family;" Regulates apoptosis"""
2;"""C-X-C motif chemokine ligand 12"; 3; 49225643; 49226230; +; Protein-coding; TTTGCTGCC... (nucleotide sequence shortened); Low; 0.0011; Attracts immune cells;" Expressed in inflammation"""
3;"""DNA repair protein RAD51 homolog 1"; 15; 48846183; 48852022; +; Protein-coding; GTAGCTGAT... (nucleotide sequence shortened); Medium; 0.0082; Involved in DNA repair;" Crucial for genome stability"""
4;"""Fructose-bisphosphate aldolase A"; 9; 22241389; 22250601; +; Protein-coding; CGTGCGATG... (nucleotide sequence shortened); High; 0.015; Metabolic enzyme in glycolysis;" Widely expressed"""
5;"""Glyceraldehyde-3-phosphate dehydrogenase"; 12; 25829409; 25836939; -; Protein-coding; AGGCCTAAG... (nucleotide sequence shortened); Very High; 0.021; Central metabolic enzyme;" Nearly ubiquitous expression"""
6;"""Hemoglobin subunit beta"; 11; 5271625; 5276811; -; Protein-coding; AGAGAAGCG... (nucleotide sequence shortened); High; 0.018; Oxygen transport;" Erythrocyte-specific"""
7;"""Interleukin-2 receptor subunit gamma"; 10; 90437472; 90443060; +; Protein-coding; TATGCAATG... (nucleotide sequence shortened); Medium; 0.0097; Cytokine receptor component;" Implicated in immune function"""
8;"""Leucine-rich repeat kinase 2"; 12; 55637347; 55648374; +; Protein-coding; GCGTCTGCT... (nucleotide sequence shortened); Low; 0.0034; Regulates neuronal signaling;" Associated with Parkinson's disease"""
9;"""Microtubule-associated protein tau"; 17; 45117016; 45152659; +; Protein-coding; ATCGTCCTG... (nucleotide sequence shortened); Medium; 0.0075; Involved in microtubule dynamics;" Linked to neurodegenerative disorders""</s>"
