;Commodity Prices;Bond Yields;Central Bank Policy;Derivatives;Consumer Credit;Earnings Reports;Economic Indicators;Industry Analysis;Mutual Funds;Options;Regulatory Environment;Retail Sales;Sector Performance;Shadow Banking;Commercial Paper
65; Platinum $850/oz; Portugal 10-year yield 1.3%; RBA maintains rates; Platinum futures rise; Consumer debt decreases 1%; Q4 earnings meet forecast; Fear of economic slowdown; Consumer confidence declines; Commodities sector down; Low-premium options; Regulatory pressure; Retail sales grow 0.4%; Platinum mining sector steady; Platinum demand rises; Commercial paper rates steady.
66; Palladium $1,500/oz; Ireland 10-year yield 0.7%; Norges Bank maintains rates; Palladium futures steady; Consumer debt rises 1.4%; Q1 earnings below expectations; Call for rate cuts; Consumer prices edge up; Precious metals sector down; In-the-money options; Regulatory scrutiny; Retail sales drop 0.3%; Palladium mining sector steady; Palladium demand up; Commercial paper rates steady.
67; Steel $550/ton; Belgium 10-year yield 0.4%; BoJ maintains rates; Steel futures drop; Consumer debt rises 0.8%; Q2 earnings exceed expectations; Call for fiscal reforms; Consumer prices steady; Materials sector up; At-the-money options; Regulatory easing; Retail sales rise 0.5%; Steel mining sector stable; Steel demand rises; Commercial paper rates steady.
68; Iron Ore $80/ton; Denmark 10-year yield 0.2%; ECB maintains rates; Iron Ore futures steady; Consumer debt decreases 0.7%; Q3 earnings meet expectations; Fear of trade tensions; Consumer sentiment improves; Basic materials sector up; Low-premium options; Regulatory reforms; Retail sales steady; Iron Ore mining sector steady; Iron Ore demand rises; Commercial paper rates steady.
69; Copper $7,900/ton; Netherlands 10-year yield 0.8%; BoJ maintains rates; Copper futures edge up; Consumer debt rises 1%; Q4 earnings below forecast; Call for monetary policy review; Consumer prices rise; Basic materials sector down; In-the-money options; Regulatory tightening; Retail sales rise 0.6%; Copper mining sector up; Copper demand up; Commercial paper rates steady.</s>
70;  Gold $1,300/ounce; Sweden 10-year yield 0.6%; Fed maintains rates; Gold futures rise; Consumer debt rises 0.9%; Q1 earnings exceed expectations; Call for financial stability; Consumer prices steady; Precious metals sector up; Out-of-the-money options; Regulatory easing; Retail sales rise 0.7%; Gold mining sector up; Gold demand up; Commercial paper rates steady.
71; Corn $70/bushel; Switzerland 10-year yield -0.2%; ECB maintains rates; Corn futures steady; Consumer debt decreases 0.6%; Q2 earnings meet expectations; Fear of agricultural overproduction; Consumer sentiment improves; Agriculture sector up; Low-premium options; Regulatory reforms; Retail sales steady; Corn farming sector steady; Corn demand rises; Commercial paper rates steady.
72; Crude Oil $55/barrel; UK 10-year yield 1.1%; BoE raises rates; Crude futures fall; Consumer debt rises 1.2%; Q3 earnings below forecast; Call for energy policy reforms; Consumer prices rise; Energy sector down; In-the-money options; Regulatory tightening; Retail sales rise 0.5%; Crude oil production sector steady; Crude oil demand rises; Commercial paper rates steady.
73; Lumber $350/1,000 board feet; Germany 10-year yield 0.3%; ECB maintains rates; Lumber futures edge up; Consumer debt decreases 0.7%; Q4 earnings exceed expectations; Call for housing market reforms; Consumer prices steady; Construction sector up; At-the-money options; Regulatory easing; Retail sales rise 0.6%; Lumber production sector steady; Lumber demand rises; Commercial paper rates steady.
74; Soybeans $50/bushel; France 10-year yield 0.7%; ECB maintains rates; Soybean futures steady; Consumer debt rises 1%; Q1 earnings meet expectations; Fear of trade tensions; Consumer sentiment improves; Agriculture sector steady; Low-premium options; Regulatory reforms; Retail sales steady; Soybean farming sector steady; Soybean demand rises; Commercial paper rates steady.
75; Natural Gas $20/MMBtu; Spain 10-year yield 1.3%; ECB maintains rates; Natural gas futures steady; Consumer debt decreases 0.8%; Q2 earnings exceed expectations; Call for energy policy reforms; Consumer prices rise; Energy sector down; In-the-money options; Regulatory tightening; Retail sales rise 0.6%; Natural gas production sector steady; Natural gas demand rises; Commercial paper rates steady.
76; Sugar $13/pound; Italy 10-year yield 2.5%; ECB maintains rates; Sugar futures steady; Consumer debt rises 1.1%; Q3 earnings below forecast; Call for fiscal reforms; Consumer prices steady; Food sector up; At-the-money options; Regulatory easing; Retail sales rise 0.7%; Sugar production sector up; Sugar demand rises; Commercial paper rates steady.
77; Wheat $20/bushel; Portugal 10-year yield 1.7%; ECB maintains rates; Wheat futures edge up; Consumer debt decreases 0.6%; Q4 earnings exceed expectations; Call for agricultural policy reforms; Consumer prices steady; Agriculture sector up; Low-premium options; Regulatory reforms; Retail sales steady; Wheat farming sector steady; Wheat demand rises; Commercial paper rates steady.
78; Platinum $950/ounce; Finland 10-year yield 0.8%; ECB maintains rates; Platinum futures rise; Consumer debt rises 0.9%; Q1 earnings meet expectations; Fear of supply disruptions; Consumer sentiment improves; Precious metals sector up; Out-of-the-money options; Regulatory easing; Retail sales rise 0.7%; Platinum mining sector up; Platinum demand up; Commercial paper rates steady.
79; Palladium $1,700/ounce; Ireland 10-year yield 0.6%; ECB maintains rates; Palladium futures steady; Consumer debt decreases 0.7%; Q2 earnings exceed expectations; Call for supply chain reforms; Consumer prices rise; Precious metals sector up; In-the-money options; Regulatory tightening; Retail sales rise 0.5%; Palladium mining sector steady; Palladium demand rises; Commercial paper rates steady.</s>
80;  Nickel $50/pound; Belgium 10-year yield 0.2%; ECB maintains rates; Nickel futures rise; Consumer debt increases 1%; Q3 earnings meet expectations; Concerns over inventory levels; Consumer sentiment steady; Base metals sector up; At-the-money options; Regulatory reforms; Retail sales rise 0.4%; Nickel mining sector up; Nickel demand rises; Commercial paper rates steady.
81; Steel $600/ton; Netherlands 10-year yield 0.1%; ECB maintains rates; Steel futures steady; Consumer debt decreases 0.5%; Q4 earnings exceed expectations; Call for fair trade policies; Consumer prices steady; Industrial metals sector up; Out-of-the-money options; Regulatory easing; Retail sales steady; Steel production sector steady; Steel demand rises; Commercial paper rates steady.
82; Aluminum $1,800/ton; Austria 10-year yield 0.3%; ECB maintains rates; Aluminum futures edge down; Consumer debt increases 0.8%; Q1 earnings meet expectations; Fear of oversupply; Consumer sentiment improves; Light metals sector up; In-the-money options; Regulatory tightening; Retail sales rise 0.6%; Aluminum mining sector up; Aluminum demand up; Commercial paper rates steady.
83; Copper $00/pound; Luxembourg 10-year yield 0.4%; ECB maintains rates; Copper futures rise; Consumer debt decreases 0.6%; Q2 earnings exceed expectations; Call for sustainable mining practices; Consumer prices rise; Base metals sector up; Low-premium options; Regulatory reforms; Retail sales rise 0.5%; Copper mining sector steady; Copper demand rises; Commercial paper rates steady.
84; Zinc $2,700/ton; Denmark 10-year yield 0.0%; ECB maintains rates; Zinc futures steady; Consumer debt increases 0.9%; Q3 earnings meet expectations; Fear of export restrictions; Consumer sentiment steady; Base metals sector up; At-the-money options; Regulatory easing; Retail sales rise 0.4%; Zinc mining sector up; Zinc demand rises; Commercial paper rates steady.
85; Lead $2,100/ton; France 10-year yield 0.1%; ECB maintains rates; Lead futures edge down; Consumer debt decreases 0.7%; Q4 earnings exceed expectations; Call for environmental regulations; Consumer prices steady; Industrial metals sector up; Out-of-the-money options; Regulatory tightening; Retail sales steady; Lead mining sector steady; Lead demand rises; Commercial paper rates steady.
86; Tin $19,500/ton; Germany 10-year yield 0.2%; ECB maintains rates; Tin futures rise; Consumer debt increases 1%; Q1 earnings meet expectations; Fear of supply disruptions; Consumer sentiment improves; Base metals sector up; In-the-money options; Regulatory reforms; Retail sales rise 0.6%; Tin mining sector up; Tin demand rises; Commercial paper rates steady.
87; Gold $1,300/ounce; Greece 10-year yield 1.3%; ECB maintains rates; Gold futures steady; Consumer debt decreases 0.5%; Q2 earnings exceed expectations; Call for investment diversification; Consumer prices steady; Precious metals sector up; Low-premium options; Regulatory tightening; Retail sales steady; Gold mining sector steady; Gold demand rises; Commercial paper rates steady.
88; Silver $50/ounce; Italy 10-year yield 1.5%; ECB maintains rates; Silver futures rise; Consumer debt increases 0.9%; Q3 earnings meet expectations; Fear of economic slowdown; Consumer sentiment steady; Precious metals sector up; At-the-money options; Regulatory easing; Retail sales rise 0.4%; Silver mining sector up; Silver demand rises; Commercial paper rates steady.
89; Cobalt $35,000/ton; Spain 10-year yield 1.2%; ECB maintains rates; Cobalt futures edge up; Consumer debt decreases 0.6%; Q4 earnings exceed expectations; Call for ethical sourcing; Consumer prices rise; Industrial metals sector up; In-the-money options; Regulatory reforms; Retail sales rise 0.5%; Cobalt mining sector steady; Cobalt demand rises; Commercial paper rates steady.</s>
