;Attenuation Factors;Intraplate Seismicity;Ambient Noise Levels;Mantle Transition Zone Structure;Crustal Fluid Flow;Core-Mantle Boundary Features;Upper Mantle Shear Wave Splitting;Lithospheric Flexure;Microseismicity and Stress Field;Laboratory Rock Physics Experiments
0; Attenuation Factors: Q values for shear waves; Intraplate Seismicity: Rare events in stable interior; Ambient Noise Levels: Low in remote areas; Mantle Transition Zone Structure: Complex features at 400-km depth; Crustal Fluid Flow: Affects seismic velocities; Core-Mantle Boundary Features: Dynamic interactions; Upper Mantle Shear Wave Splitting: Anisotropy due to crystal alignment; Lithospheric Flexure: Deformation from loads; Microseismicity and Stress Field: Relation to tectonic forces; Laboratory Rock Physics Experiments: Studying seismic properties.
1; Attenuation Factors: Variations in frequency; Intraplate Seismicity: Aseismic creep and slow slip; Ambient Noise Levels: Influenced by surface activities; Mantle Transition Zone Structure: Ultralow-velocity zones; Crustal Fluid Flow: Pathways and compartments; Core-Mantle Boundary Features: Ultra-dense anomalies; Upper Mantle Shear Wave Splitting: Hemisphere asymmetry; Lithospheric Flexure: Oceanic vs. continental; Microseismicity and Stress Field: Relation to fluid pressure; Laboratory Rock Physics Experiments: Hydrogen bonds in minerals.
2; Attenuation Factors: Depth-dependent variations; Intraplate Seismicity: Triggered by regional stress; Ambient Noise Levels: Sensitive to cultural factors; Mantle Transition Zone Structure: Evidence for partial melt; Crustal Fluid Flow: Impact on seismic anisotropy; Core-Mantle Boundary Features: Seismic hum and free oscillations; Upper Mantle Shear Wave Splitting: Contributions from mantle flow; Lithospheric Flexure: Fold and thrust belts; Microseismicity and Stress Field: Coupling with the asthenosphere; Laboratory Rock Physics Experiments: Phase transitions in minerals.
3; Attenuation Factors: Anisotropy and anelasticity; Intraplate Seismicity: Induced by glacial isostasy; Ambient Noise Levels: Spatial correlations; Mantle Transition Zone Structure: Differential diffusion; Crustal Fluid Flow: Hydrological cycles and earthquakes; Core-Mantle Boundary Features: Gravity-driven flows; Upper Mantle Shear Wave Splitting: Lattice-preferred orientation; Lithospheric Flexure: Bending stiffness; Microseismicity and Stress Field: Fault slip tendency; Laboratory Rock Physics Experiments: Deformation mechanisms.
4; Attenuation Factors: Influence on seismic imaging; Intraplate Seismicity: Near-lack of seismic activity; Ambient Noise Levels: Seasonal differences; Mantle Transition Zone Structure: Thermal and compositional effects; Crustal Fluid Flow: Subsurface fluid migration; Core-Mantle Boundary Features: Lateral temperature variations; Upper Mantle Shear Wave Splitting: Impact of lithospheric age; Lithospheric Flexure: Mechanical properties; Microseismicity and Stress Field: Correlation with geothermal gradient; Laboratory Rock Physics Experiments: Experimental seismology.
5; Attenuation Factors: Importance in earthquake engineering; Intraplate Seismicity: Intraplate deep earthquakes; Ambient Noise Levels: Sensitivity to topography; Mantle Transition Zone Structure: Mantle dynamics; Crustal Fluid Flow: Seismic attributes; Core-Mantle Boundary Features: Seismic tomography; Upper Mantle Shear Wave Splitting: Radial anisotropy; Lithospheric Flexure: Subsidence and uplift; Microseismicity and Stress Field: Statistical analysis; Laboratory Rock Physics Experiments: Rheological behavior.
6; Attenuation Factors: Spatial distribution; Intraplate Seismicity: Stress accumulation; Ambient Noise Levels: Wind and water sources; Mantle Transition Zone Structure: Seismic discontinuities; Crustal Fluid Flow: Magmatic systems; Core-Mantle Boundary Features: Electromagnetic signals; Upper Mantle Shear Wave Splitting: Mantle upwelling; Lithospheric Flexure: Elastic and viscous properties; Microseismicity and Stress Field: Stress orientation; Laboratory Rock Physics Experiments: Porosity and permeability.
7; Attenuation Factors: Dispersion and attenuation; Intraplate Seismicity: Volcanic earthquakes; Ambient Noise Levels: Ground roll; Mantle Transition Zone Structure: Subducting slabs; Crustal Fluid Flow: Geysers and hot springs; Core-Mantle Boundary Features: Seismic source processes; Upper Mantle Shear Wave Splitting: S-wave shadow; Lithospheric Flexure: Isostatic adjustment; Microseismicity and Stress Field: Magnitude-frequency relations; Laboratory Rock Physics Experiments: Strength and deformability.
8; Attenuation Factors: Impact of composition; Intraplate Seismicity: Strike-slip earthquakes; Ambient Noise Levels: Anthropogenic sources; Mantle Transition Zone Structure: Anomalous heterogeneities; Crustal Fluid Flow: Groundwater dynamics; Core-Mantle Boundary Features: Convective patterns; Upper Mantle Shear Wave Splitting: Lateral homogeneity; Lithospheric Flexure: Ridge push and slab pull; Microseismicity and Stress Field: Focal mechanisms; Laboratory Rock Physics Experiments: Pore fluid pressures.
9; Attenuation Factors: Temporal changes; Intraplate Seismicity: Seismic gaps; Ambient Noise Levevls: Diurnal variations; Mantle Transition Zone Structure: Seismic anisotropy; Crustal Fluid Flow: Aquifer systems; Core-Mantle Boundary Features: Core-mantle coupling; Upper Mantle Shear Wave Splitting: Mantle plumes; Lithospheric Flexure: Flexural isostasy; Microseismicity and Stress Field: Tectonic strain analysis; Laboratory Rock Physics Experiments: Frictional properties.</s>
