Author | Series | Book Number | Characters | Pages | Setting | Time Period | Point of View | Villain | Conflict | Twist | Resolution
Baldacci | Camel Club | 1 | 7 | 400 | Washington D.C. | 21st Century | Multiple | Gray Saul | Saving a President | Gray Saul's past | Camel Club's mission is a success 
King | The Dark Tower | 7 | 10 | 700 | Medieval | Post-Apocalyptic | Third-Person | John Farson | Unifying The Dark Tower | King wants to end the series with the Tower safe | The Tower is saved 
Grisham | Mitch McDeere | 2 | 5 | 500 | Washington D.C. | 1990s | First-Person | Ginger LaBianca | Stop a Murderer | Identity of the murderer | Mitch uncovers the identity of the murderer 
Clancy | Jack Ryan | 1 | 3 | 400 | Washington D.C. | 1970s | Third-Person | Antonin Grinko | Revenge | Hero changes into a different person | Ryan saves the day 
Rowling | Harry Potter | 5 | 5 | 600 | The Wizarding World | 1990s | Third-Person | Tom Riddle | Defeat Voldemort | Discovery of identity of He-Who-Must-Not-Be-Named | Voldemort is defeated
