Sports | Stadium | Officials | History | Equipment | Teams | Fan Base | Athletes | Education | Influencers
Baseball | Ballpark | Umpires, Referees | 1744 – Start of Modern Baseball | Base, Glove | Red Sox, Cubs | National Pastime | Babe Ruth, Alex Rodriguez | Baseball Clinics, Hitting Instruction | Players, Broadcasters
Football | Arena | Referee, Linesman | 1869 – Origins of Modern Football | Shoulder Pads, Helmet | Steelers, Packers | Sunday Football Fans | Tom Brady, Aaron Rodgers | Quarterback Academies, Football Camps | Owners, Writers
Golf | Country Club | Caddies, Marshalls | 15th Century – Origin of Modern Golf | Clubs, Balls | Bay Hill, Pebble Beach | Golf Enthusiasts | Tiger Woods, Rory McIlroy | Golf Schools, Coaching Lessons | Writers, Analysts
Hockey | Ice Rink | Referee, Linesman  | 1875 – Origins of Modern Hockey | Skates, Sticks | Blackhawks, Maple Leafs | NHL Fans | Sidney Crosby, Connor McDavid | Skating Skills, Stickhandling | Players, Coaches
Basketball | Court | Referee, Scorer | 1891 – Origins of Modern Basketball | Ball, Hoop | Warriors, Celtics | College Hoops | LeBron James, Stephen Curry | Hoop Camps, 3-Point Shooting | Players, Journalists
Volleyball | Sandpit | Referee, Linesman | 1897 – Founding of Volleyball | Ball, Net | Russia, Italy | BeachGoers | Kerri Walsh, Misty May | Passing Clinics, Jump Serving | Coaches, Reporters
Soccer | Pitch | Referee, Linesman | 1863 – Invention of Soccer | Ball, Cleats | FC Barcelona, Real Madrid | Fans Around the World | Messi, Ronaldo | Soccer Camps, League Play | Owners, Commentators
Tennis | Court | Umpire, Line Judge | 12th century – Start of Tennis | Racquet, Balls | Wimbledon, Roland Garros | Grand Slam Lovers | Roger Federer, Serena Williams | Serving Lessons, Forehand Techniques | Players, Journalists
